{
  "handoff": [
    {
      "dataset_family": "journals",
      "next_track": "parliament_dataset_full_acquisition_20260703",
      "proof_requirement": "Use one bounded seed proof per family before any bulk-acquisition implementation."
    },
    {
      "dataset_family": "papers_presented_ajhr",
      "next_track": "parliament_dataset_full_acquisition_20260703",
      "proof_requirement": "Preserve source URLs, hashes, and rights notes for the full-acquisition track."
    },
    {
      "dataset_family": "order_paper_questions_business_sitting_programme",
      "next_track": "parliament_dataset_full_acquisition_20260703",
      "proof_requirement": "Keep question/business pages bounded and resumable."
    },
    {
      "dataset_family": "select_committees",
      "next_track": "parliament_dataset_full_acquisition_20260703",
      "proof_requirement": "Use the same sample URLs and hashes as the acquisition contract entry points."
    },
    {
      "dataset_family": "petitions",
      "next_track": "parliament_dataset_full_acquisition_20260703",
      "proof_requirement": "Record access constraints before any petition content harvesting."
    },
    {
      "dataset_family": "members_parties_seating_contacts",
      "next_track": "parliament_dataset_full_acquisition_20260703",
      "proof_requirement": "Preserve contact-download and seating-page provenance before any expansion."
    }
  ],
  "inventory_manifest": "manifests/parliament_dataset_inventory.json",
  "manifest_version": 1,
  "policy": {
    "no_bulk_acquisition": true,
    "no_completion_claim": true,
    "official_sources_first": true
  },
  "repository": "corpus-nz-hansard",
  "retrieved_at": "2026-07-03T13:02:15Z",
  "summary": {
    "approved_target_count": 19,
    "blocked_target_count": 0,
    "deferred_target_count": 0,
    "fetched_target_count": 0,
    "index_only_target_count": 19,
    "total_target_count": 19
  },
  "targets": [
    {
      "access_constraints": "Public archive with weekly documents; detail pages may include related links and downloads.",
      "approved": true,
      "blocked_reason": "No sample link could be discovered from the index response.",
      "dataset_family": "journals",
      "fetched_at": "2026-07-03T13:02:13Z",
      "index_fetched_at": "2026-07-03T13:02:13Z",
      "index_record_count": 0,
      "index_sha256": "3caeb3d385ed3eee9b7f5de8761cdef14bf1466dc397e428a14ce6f27d3033a0",
      "index_url": "https://www3.parliament.nz/en/pb/journals-of-the-house/weekly-journals-archive/",
      "output_paths": {
        "index": "derived/parliament_dataset_seed_fetchers/journals/nz-parliament-weekly-journals-archive/index.html"
      },
      "proof_status": "index-only",
      "request_urls": [
        "https://www3.parliament.nz/en/pb/journals-of-the-house/weekly-journals-archive/"
      ],
      "sample_fetched_at": null,
      "sample_record_count": 0,
      "sample_sha256": null,
      "sample_url": null,
      "source_id": "nz-parliament-weekly-journals-archive",
      "source_posture": "official"
    },
    {
      "access_constraints": "Public Parliament pages or linked downloads; discover exact current URLs in seed track.",
      "approved": true,
      "blocked_reason": "No sample link could be discovered from the index response.",
      "dataset_family": "journals",
      "fetched_at": "2026-07-03T13:02:13Z",
      "index_fetched_at": "2026-07-03T13:02:13Z",
      "index_record_count": 0,
      "index_sha256": "9f417efc21c1a6db6d28b188d4b4b7a2d14c8d4b9ea1b3b41ebf275951ec7749",
      "index_url": "https://www3.parliament.nz/en/pb/journals-of-the-house/",
      "output_paths": {
        "index": "derived/parliament_dataset_seed_fetchers/journals/nz-parliament-journals-session-indexes/index.html"
      },
      "proof_status": "index-only",
      "request_urls": [
        "https://www3.parliament.nz/en/pb/journals-of-the-house/"
      ],
      "sample_fetched_at": null,
      "sample_record_count": 0,
      "sample_sha256": null,
      "sample_url": null,
      "source_id": "nz-parliament-journals-session-indexes",
      "source_posture": "official"
    },
    {
      "access_constraints": "Public listing and downloads; exact document URLs should be captured in seed manifests.",
      "approved": true,
      "blocked_reason": "No sample link could be discovered from the index response.",
      "dataset_family": "papers_presented_ajhr",
      "fetched_at": "2026-07-03T13:02:13Z",
      "index_fetched_at": "2026-07-03T13:02:13Z",
      "index_record_count": 0,
      "index_sha256": "1fccac87e057f4aa1ce5eeaa725deeac027e4d994b93bd9fa5d54ec0d594cc98",
      "index_url": "https://www3.parliament.nz/en/pb/papers-presented/",
      "output_paths": {
        "index": "derived/parliament_dataset_seed_fetchers/papers_presented_ajhr/nz-parliament-papers-presented/index.html"
      },
      "proof_status": "index-only",
      "request_urls": [
        "https://www3.parliament.nz/en/pb/papers-presented/"
      ],
      "sample_fetched_at": null,
      "sample_record_count": 0,
      "sample_sha256": null,
      "sample_url": null,
      "source_id": "nz-parliament-papers-presented",
      "source_posture": "official"
    },
    {
      "access_constraints": "Public current papers page; downloads may change.",
      "approved": true,
      "blocked_reason": "No sample link could be discovered from the index response.",
      "dataset_family": "papers_presented_ajhr",
      "fetched_at": "2026-07-03T13:02:13Z",
      "index_fetched_at": "2026-07-03T13:02:13Z",
      "index_record_count": 0,
      "index_sha256": "505b964a430fc65a5745425e688e7ba20074c2eab77b0b5a4cb68937ad75a019",
      "index_url": "https://www3.parliament.nz/en/pb/papers-presented/current-papers/",
      "output_paths": {
        "index": "derived/parliament_dataset_seed_fetchers/papers_presented_ajhr/nz-parliament-current-papers/index.html"
      },
      "proof_status": "index-only",
      "request_urls": [
        "https://www3.parliament.nz/en/pb/papers-presented/current-papers/"
      ],
      "sample_fetched_at": null,
      "sample_record_count": 0,
      "sample_sha256": null,
      "sample_url": null,
      "source_id": "nz-parliament-current-papers",
      "source_posture": "official"
    },
    {
      "access_constraints": "Public Parliament/AJHR surface or linked historical downloads; seed track must verify exact current URL and rights.",
      "approved": true,
      "blocked_reason": "No sample link could be discovered from the index response.",
      "dataset_family": "papers_presented_ajhr",
      "fetched_at": "2026-07-03T13:02:13Z",
      "index_fetched_at": "2026-07-03T13:02:13Z",
      "index_record_count": 0,
      "index_sha256": "61f0b42757b537f5c85e77acd6a074738050d3b061778ca68137e5a9b0698c8f",
      "index_url": "https://www3.parliament.nz/en/pb/papers-presented/",
      "output_paths": {
        "index": "derived/parliament_dataset_seed_fetchers/papers_presented_ajhr/nz-parliament-ajhr/index.html"
      },
      "proof_status": "index-only",
      "request_urls": [
        "https://www3.parliament.nz/en/pb/papers-presented/"
      ],
      "sample_fetched_at": null,
      "sample_record_count": 0,
      "sample_sha256": null,
      "sample_url": null,
      "source_id": "nz-parliament-ajhr",
      "source_posture": "official"
    },
    {
      "access_constraints": "Public National Library/Papers Past service; OCR and volume structure require review.",
      "approved": true,
      "blocked_reason": "No sample link could be discovered from the index response.",
      "dataset_family": "papers_presented_ajhr",
      "fetched_at": "2026-07-03T13:02:13Z",
      "index_fetched_at": "2026-07-03T13:02:13Z",
      "index_record_count": 0,
      "index_sha256": "0a46e00c0400ef50e0a1c56664b2c591a722cacbbc7ec5e43f07685d7c42b0ae",
      "index_url": "https://paperspast.natlib.govt.nz/parliamentary",
      "output_paths": {
        "index": "derived/parliament_dataset_seed_fetchers/papers_presented_ajhr/papers-past-ajhr/index.html"
      },
      "proof_status": "index-only",
      "request_urls": [
        "https://paperspast.natlib.govt.nz/parliamentary"
      ],
      "sample_fetched_at": null,
      "sample_record_count": 0,
      "sample_sha256": null,
      "sample_url": null,
      "source_id": "papers-past-ajhr",
      "source_posture": "fallback"
    },
    {
      "access_constraints": "Public page with HTML listings and document downloads.",
      "approved": true,
      "blocked_reason": "No sample link could be discovered from the index response.",
      "dataset_family": "order_paper_questions_business_sitting_programme",
      "fetched_at": "2026-07-03T13:02:14Z",
      "index_fetched_at": "2026-07-03T13:02:14Z",
      "index_record_count": 0,
      "index_sha256": "80597d9a9c60a1ac9bedbb0ac121dd1095f685c800b0e4989dfbd97a18ee7a69",
      "index_url": "https://www3.parliament.nz/en/pb/order-paper-questions/order-paper/",
      "output_paths": {
        "index": "derived/parliament_dataset_seed_fetchers/order_paper_questions_business_sitting_programme/nz-parliament-order-paper/index.html"
      },
      "proof_status": "index-only",
      "request_urls": [
        "https://www3.parliament.nz/en/pb/order-paper-questions/order-paper/"
      ],
      "sample_fetched_at": null,
      "sample_record_count": 0,
      "sample_sha256": null,
      "sample_url": null,
      "source_id": "nz-parliament-order-paper",
      "source_posture": "official"
    },
    {
      "access_constraints": "Public Parliament/Bills platform; may be JavaScript-rendered.",
      "approved": true,
      "blocked_reason": "No sample link could be discovered from the index response.",
      "dataset_family": "order_paper_questions_business_sitting_programme",
      "fetched_at": "2026-07-03T13:02:14Z",
      "index_fetched_at": "2026-07-03T13:02:14Z",
      "index_record_count": 0,